{
  "algorithm": "ed25519",
  "key_id": "fe812c12f3ab4ce6ac5db69ac352f906cb1b11ef43fb33e252ef7ff552263889",
  "object": "bloom.signed_model_index",
  "payload": "ewogICJzY2hlbWFfdmVyc2lvbiI6IDEsCiAgIm9iamVjdCI6ICJibG9vbS5tb2RlbF9pbmRleCIsCiAgIm5hbWUiOiAiQmxvb20gRXhhbXBsZSBNb2RlbHMiLAogICJnZW5lcmF0ZWRfYXQiOiAxNzg1NTEzNjAwLAogICJleHBpcmVzX2F0IjogMTgxNjk2MzIwMCwKICAibW9kZWxzIjogWwogICAgewogICAgICAiaWQiOiAiZXhhbXBsZS10aW55LXE0IiwKICAgICAgIm5hbWUiOiAiRXhhbXBsZSBUaW55IFE0IiwKICAgICAgImRlc2NyaXB0aW9uIjogIkRvY3VtZW50YXRpb24tb25seSBlbnRyeSBzaG93aW5nIHRoZSBzaWduZWQgZGlzY292ZXJ5IGZvcm1hdC4iLAogICAgICAiZG93bmxvYWRfdXJsIjogImh0dHBzOi8vaHVnZ2luZ2ZhY2UuY28vZXhhbXBsZS1vcmcvZXhhbXBsZS1tb2RlbC9yZXNvbHZlLzAxMjM0NTY3ODlhYmNkZWYwMTIzNDU2Nzg5YWJjZGVmMDEyMzQ1NjcvZXhhbXBsZS10aW55LXE0LmdndWYiLAogICAgICAiZmlsZW5hbWUiOiAiZXhhbXBsZS10aW55LXE0LmdndWYiLAogICAgICAic2l6ZV9ieXRlcyI6IDEwNDg1NzYsCiAgICAgICJzaGEyNTYiOiAiMDEyMzQ1Njc4OWFiY2RlZjAxMjM0NTY3ODlhYmNkZWYwMTIzNDU2Nzg5YWJjZGVmMDEyMzQ1Njc4OWFiY2RlZiIsCiAgICAgICJsaWNlbnNlIjogIkFwYWNoZS0yLjAiLAogICAgICAiZmFtaWx5IjogIkxsYW1hIiwKICAgICAgInBhcmFtZXRlcl9jb3VudCI6IDEwMDAwMDAsCiAgICAgICJxdWFudGl6YXRpb24iOiAiUTRfS19NIiwKICAgICAgInRhZ3MiOiBbImV4YW1wbGUiLCAiY3B1Il0KICAgIH0KICBdCn0K",
  "schema_version": 1,
  "signature": "qqCiCfueCAjHOxghCjUvQgoveD-U9rczfCjtmg3qTL4Jw2rTTPD1J1gt88Z4gkVB6_wvywYZwRsKBFdeyqDdAw"
}
